{"schema_version":"1.0","resolution_receipt_id":"LS-MSG-RES-UNKNOWN-001","catalog_id":"LS-MESSAGE-CATALOG-PRODUCTION-CANDIDATE","catalog_version":"1.0","catalog_sha256":"aaaaaaaaaaaaaaaaaaaaaaaaaaaaaaaaaaaaaaaaaaaaaaaaaaaaaaaaaaaaaaaa","user_message_code":"CONTRACT_COMPATIBILITY_ERROR","requested_locale":"ru-RU","resolved_locale":"uk-UA","resolution_status":"UNKNOWN_CODE","text_present":true,"semantics_preserved":true,"resolved_at":"2026-10-04T12:02:00Z"}
