{"schema_version":"1.0","resolution_receipt_id":"LS-MSG-RES-FALLBACK-001","catalog_id":"LS-MESSAGE-CATALOG-PRODUCTION-CANDIDATE","catalog_version":"1.0","catalog_sha256":"aaaaaaaaaaaaaaaaaaaaaaaaaaaaaaaaaaaaaaaaaaaaaaaaaaaaaaaaaaaaaaaa","user_message_code":"PASSPORT_UPDATE_CONFIRMED","requested_locale":"en-US","resolved_locale":"uk-UA","resolution_status":"UNSUPPORTED_LOCALE_FALLBACK","text_present":true,"semantics_preserved":true,"resolved_at":"2026-10-04T12:01:00Z"}
