{"schema_version":"1.0","resolution_receipt_id":"LS-MSG-RES-DIRECT-001","catalog_id":"LS-MESSAGE-CATALOG-PRODUCTION-CANDIDATE","catalog_version":"1.0","catalog_sha256":"aaaaaaaaaaaaaaaaaaaaaaaaaaaaaaaaaaaaaaaaaaaaaaaaaaaaaaaaaaaaaaaa","user_message_code":"PASSPORT_UPDATE_CONFIRMED","requested_locale":"ru-RU","resolved_locale":"ru-RU","resolution_status":"DIRECT","text_present":true,"semantics_preserved":true,"resolved_at":"2026-10-04T12:00:00Z"}
